{
  "schema_version": "obs.recorder_buffer_status.v1",
  "target_id": "local",
  "storage_mode": "memory_ring",
  "volatile": true,
  "survives_daemon_restart": false,
  "survives_target_reboot": false,
  "survives_power_loss": false,
  "retention_ms": 60000,
  "current_retained_range_mono_ns": {
    "start": 1000000000,
    "end": 61000000000
  },
  "signals": [
    {
      "signal_id": "cpu.summary",
      "configured_interval_ms": 1000,
      "expected_samples": 60,
      "recorded_samples": 60,
      "dropped_samples": 0,
      "gap_ranges": [],
      "degraded": false,
      "data_quality": {
        "dropped": false,
        "drop_count": 0,
        "throttled": false,
        "missing": [],
        "truncated": false,
        "clock_confidence": "medium",
        "notes": []
      }
    }
  ],
  "data_quality": {
    "dropped": false,
    "drop_count": 0,
    "throttled": false,
    "missing": [],
    "truncated": false,
    "clock_confidence": "medium",
    "notes": []
  }
}
